Utterance,Type,Dialogue Act
"Tahole asun gyanibhabe shokriyo hobar bishoye kotha boli. Aponi janen, aponi ekhon obosorpropto. Aponi ki korte?",T,irq
Ami 44 bochor dhore ekjon nurse chhilam.,P,id
Thik achhe. Ebong eta chhilo je aponi khub bishtho rakha.,T,crq
"Eta eta koreche. Eta noy je amar panchti santan chhilo ebong ami amar swamike post office chalate sahayyo korechi. Tai ami sei dingulite shoptahe 70 ghonta kaj kortam karon ami dui rat night duty korechi tara 12 ghonta shift alada chhilo. Ebong tarpor ami dokane kaj. Tai besh kichu chakri. Tai panch bochor dhore ami setai korechi jate aponi janen, ebong sei borshe bari-r bachchader dekhashona korechi.",P,cd
"Aponi je ekhon obosor niechen, aponi kono svecchashebik kaj koren na koren.",T,yq
"Hyan, ami girjar ashepasher jinisgulir sathe jorito hoye gecho ghor-er abdho porishon ebor tarader baire nie jowar ebong ei jatio jinisgulir sathe. Ebong ami ekhono amar konyader modhe ekta bishesh proyog-er jonno amake ekta poribahan yatri sahakari hoiye chakri deoya holo. Proyojone onek base jatathat kore. Hyan. Tai tader jonno Moriya chhilo. Ebong se bollo, tomi sei make bhalo korbe. Tai je aponi sign up chhilen. Tini amake sign up. Karon se kaj korechen. Tini manager chhilen. Tai ami 77 bochor bosh porjonto eti korechi. Ebong ami ABSEM music poriksha-r jonno 11 shoptah stewarding korechi.",P,id
Hyan. Ebong aponi sobshomoy ei moto chhilen?,T,yq
"Hyan, hyan.",P,op
Apanar ki onek samajik shomorthon aache?,T,yq
"Hyan, ami kori. Hyon. Hyon. Thik achhe, tar cheyeo beshi ekhon je bachchara amake Facebook ebong Whatsapp-e chapachchhe. Ki darun. Ami bolte chhachchi, eta thik, eta ekhon sara biswe porjonto, aponi janen?",P,id
"Aponi antorjatik? Hya, hya. Hyan. Ebong ami bisheshobhabe mone kori je aponi ekjon Airbnb host.",T,irq
Hyan ami kori. Hyan. Tai poribiti amar kache shebhabe ashe. Chomotkar.,P,id
Aponi ki eta upobhog koren?,T,yq
"Ebong tarpor ami Facebook bondhu jokhon tara drishtite China, Brazil ebong Rome bari jay ebong dekhar amontron pay.",P,id
Ebong aponi bolchen je apanar nati-natni ebong nati-natni ache. Aponi ki mone koren je antorjatik jogajog guruttopurno?,T,orq
Khuboi guruttopurno.,P,od
Keno?,T,irq
"Karon aponi jokhon bachchader lalonpalon koren, tokhon tader chokh diyey prithibi dekhar somoy aponar kache thake na. Athoba etomoi satyoi tader kotha shunun karon aponi khub bishtho ebong bishtho, kintu tarpor nati-natnira ashe ebong aro guruttopurno bhave ekhon boro nati-natnira ebong ei notun chokh diyey biswak-e taja dekha aslei besh mone poray. Tai ami onek kichu shikhechi. Purano dine, nati-natnira dada-dadir hatute shikhten kintu aajkal dada-dadir nati-natnider hatute shekhben ebong oboshoyi oh, hyan.",P,id
Hyan. Ebong aponi ki mone koren je eti bibhinn bosh-e bibhinn prjoner sathe somoy katale tader upokar kore?,T,orq
"Thik achhe, jemon ami bolchilam je tara eti dekhte pay na je aponi bosh babosh korchen, hyan, ja khub mukhti dey. Karon thik achhe, aponi janen, amar prjoner por ami jevabe boro hoyechi, dekha jay na suna jay na ebong ei somosto briddho lokder sathe parlour-e boshe thake. Ebong akhon, park-er charpase taka ghurche, aponi janen, tara adventure jinis ebong tara bolchhe, amader sathe slide ashun ebong ei shob, aponi janen, ami je kori. Ami je kori, ami kichu-i fire dei na. Etai rahasyo.",P,od
Jinish namiye na. Hyan.,T,crq
"Shudhu shobshomoy haan bolun. Haan. Bhalo dorshon, oshudh chorha, shobkichu chesta korun. EkbAr shobkichu chesta korun.",P,cd
"Pushti ebong dhorn'er shomporke apnar drishtibhongi ki, apni janen, ekti swasthokor khabar ache?",T,orq
"Ami mone kori ami mone kori torun projonmo etir upor khub beshi chhap dey, onek beshi. Apni kohon mone koren je amar projonmo jodi 100 bochor beche thake ebong amra dripping sandwich diye boro hoyechi, sambhoboto blatte marveling shoho, ityadi, ful krim dudh, baki shob. Keno chhap aout? Apni janen, porimithobhabe shobkichu khan ebong kalyan'er jonno jibon upobhog korun.",P,od
"Haan. Ami je phosphor porondra kori apni kibhabe chaper probhavguli kom korben? Apnar ki kono koushol ache, apni ki janen, apnar ki kono koushol ache ba jodi kichu chappojok hoi? Apni je bishesh kichu ache?",T,yq
"Jin ebong tonic oh, thik ache. Ami jodi sotti karo sathe somporke kori, ami khub bhalo jinis peyechi ebong ami sotti tader sathe amar moner kotha bolte chai. Ami chithi likhte khub bhalo. Ami tader kache chithi pathai na. Kintu ami eta likhe raki ebong amar system theke ber kori. Ebong ami eta ekTi drawer'e raki jodi ekdin, amike eta tader shamne fele dite habe. Kintu eta apni janen, eta bondho, eta amar mather baire. Ebong jodi amar kono bisoy'e dakterer kache jawa'r proyojon hoy, ami take ja bolte chai ta ami likhe deb, karon ami bisshobash korina je tara sorboda apnar kotha shone, bishesh kore ekti jon mohila, jodi ekti jon purush hoi, dakter, kintu tumi janO, tara jeta-i mone koruk, oh, ishwar, eta abar tar, tomi janO? Tai ami mone kori, eta niche rakun ebong tar dike hasun. Take porate habe.",P,id
"Ami mone kori apni apnar 70'er dashake. Apni apnar 70s modhye thaka upobhog koren? Apnar jiboner priyo somoy ki chhilo janen? Apni jodi paren, jodi ekTi uttor ache?",T,yq
"Na, nei. Apni shudhu protidin upobhog kora uchit jemon eti ashe ebong bosh shomporke sthbdh na kora. Haan, karon ami ekhon 90 bochorer briddher dware beshitish. Ebong sotti, tara noy bochorer moto. Amra sobcheye beshi hasi ebong tara sobcheye murchho kaj kore ebong apni janen, amader mone hoy jeno amra prokriti boyos theke mukt hoye gecho apni janen, apni ekjon ma, bachchader jonno ekTi udahoron sthapon korechen, tai na? Oh, tomi meye, jano?",P,id
Tahole apni ki mone koren eti ekTi porthokko kore? Jiboner somoy ei dhoner daitto theke chalonto dhoner moto. Tahole apni kohon apnar shontander dekhashona korchen? Apni ki pore shostir anubhuti bodh kora-r dware etai bojhate chacchen?,T,orq
"Haan. Karon apni non, keu apnake bichar korche na. Apni khub dhirgho charpase jhulche je shadha chhara. Kintu ta chhara, haan, na, eta bhalo. Mane, ami ekjon Victorian baba'r kache boro hoyechi jini ekti bank manager chhilen. Ebong eta sobshomoy mone rakha je ami ei shohore achi. Apni janen, tara sei din keu chhilen. Tumi amar shontan. Ebong, ebong tarpor ami ekTi convent bakaron giye chhilam. Shudhu mone rakhben apni meyera ke, apnar convent bakaron school'er meye, apni janen, tai eti pathano'r jonno khub beshi baki chhilo na eti haan onek chhap deyoni. Haan. Tai haan, apni jiboner modhye jachchen ei sob chhap ache. Tai eta howa bhalo ebong amar shami tar 50'er dashake mara giechhilen tai amake nijekete notun kore abishkar korte hoice, ja bhiti jonok chhilo. Eto bochor boudo ar ma hoiyar por khub bhiti korlam na kintu amar saubhagyo amar,",P,id
Ami mone kori eti hoilo ei bochore shurute ba goto bochore apni ekjon oporichito byaktir jonno besho boro kichu korechilen.,T,irq
"Oh, kIDni dan? Haan. February'te.",P,crq
Ei bochor. Hyan. Aponi ekjon aporichito byaktike ekoti kidney dane korechen.,T,cd
"Hyan, bhadralok, ami bishwas kori hyan.",P,od
Bah. Kivabe aponi je korte siddhanto niyeche? Amra eti somporkhe jante hobe. Ebong tarpor,T,yq
"Ami Facebook-e khujte peyechi, thik ache. Shironamti ki chhilo ta amake jijnasha korben na, kintu ami itimodhe mrityur pore beshi bhag lokrer onudaner moto. Tumi sobkichu jano. Ami bolte chachchi, ami medical school chore jawar jonno amar shorir chore chole jachhi, ja amar ekta meyekete khushi koreni, kintu aponi sekhane jano. Amra kivabe apanar sathe ekmat hote pari? Aponi akhono charpase jhulonto? Se bolchhilo. Tai. Tai tader kichu eta jonno chhilo. Ebong tader kichu, tader kichu chhilo na",P,id
Ebong transplant-er modhye na giye operation-er modhye jawa besh boro bishoy.,T,crq
"Ebong ami mone kori goto bochor, ami poriksha korchhilam, aponi jano, monostattik poriksha theke shuru kore somosto sharirik poriksha, ebong moshshiker scan ebong sobkichu scan kora hoyeche.",P,cd
"Hyan,",T,ack
"Eti chhilo, eti 1000 mile porishhebar cheye bhalo chhilo. Ebong ami bhebhechhilam, thik ache, ami sotti karone eti korchhi. Ami etta jani, kintu ke jani, tara amar sathe sompurno bhul kichu khujte pare. Ebong ami jevabe khujte peyechhi tai eti ekto joyer poristhiti, ami bishwas kori. Hyann. Ebong aponi jano je jodi tara apanake gruhon kore, ebong ami tader moddhe sobcheye beshi boshkorer chhilam je tader eti chhilo ebong eti 20 bochor sthayi hobe. Spashtotai, ekoti kidney 20 bochor sthayi hote pare. Je hyan, eto bhalo chhilo. Hyann. Tai tader kichhu, tai tader kichhu chhilo na",P,id
"Ami, ami mone kori ami amar talikar beshirbhag jinishoi jijnasha korechi je bishoye ami kotha bolte cheyechilam, aponi ki mone koren je ami mis korechi ja deerghokal dhore bhalo vabe beche thakar theme poriprekshite achhadito kora?",T,yq
"Thik ache, ami mone kori aponi jodi onno karo jonno jekono kichu korte paren, nijer kache jotoi kshudra pratyabartan hok na keno, ta bishal. Kintu jatokhon na aponi sei pratyabartoner jonno takan na, tobe eti thik, eti keboli hyan. Ebong eti sei karonkeo eki bhute kore je aponi akhono beche achhen je aponi jano je aponi kew gruhe sthane nichechen na. Ebong je, aponi jano, januarite apanar bhalo kichu kora uthi asha kori, parish alzheimer-er jonno korben na. Tai je parish plan ami animating korchi",P,id
Thik? Alzheimer's-er jonno arthosongroh korte lojja chhadai ei tandemti ekjon kheloyader baire.,T,id
"Hyan. Ki darun. Hyan. Hyan, etta bhalo hote hobe. Jibonke eto seriously neowar kotha noy? Thik ache, ekjon aponi jano na aponi ekhane koto kshon ache char ebong duiti keu aponar kache eto goruttorponno noy, je bissho aponi kalyaner jonno mahabishwer kendro non, aponi jano, tai keboli jinishgulir sathe agei jano ebong eti like, ami Facebook-er sathe duhkhit, aponi jano, jodi tara jotoi like na pay, aponi jano, eto kichu loker bhalo din nosto hoye gechhilo, ei sob mithya. Eta dhoya ebong aynaa. Amar ek bondhu amake eta bolachhilo jeta khuboi goruttopurno ebong khub goruttor jore bolchhilo je ami ekhono amar nijer bariro malik, dekho? Ebong se shudhu hashe bolechilo, tumi ki sotti ei ta mone koro? Rat? Hyann. Tumi jano? Oh, aponi eti apanar sathe nie jacchen? O achha. Tini bolen, jodi aponi kichur malik na hon, tini bolechhilen je eti dhoya ebong etir shomosto aynaa. Hyann, ebong eti sotti, tai na? Hyann. Tai shudhu hashte hashte sekhane jao.",P,id
Apanake dhonyobad.,T,gt
